"Authors","Author full names","Author(s) ID","Title","Year","Source title","Volume","Issue","Art. No.","Page start","Page end","Cited by","DOI","Link","Abstract","Author Keywords","Index Keywords","Document Type","Publication Stage","Open Access","Source","EID"
"Van der Beek J.P.J.; Van der Ven S.H.G.; Kroesbergen E.H.; Leseman P.P.M.","Van der Beek, Jojanneke P.J. (57195304275); Van der Ven, Sanne H.G. (36081527000); Kroesbergen, Evelyn H. (6603413373); Leseman, Paul P.M. (6602363622)","57195304275; 36081527000; 6603413373; 6602363622","How emotions are related to competence beliefs during mathematical problem solving: Differences between boys and girls","2024","Learning and Individual Differences","109","","102402","","","9","10.1016/j.lindif.2023.102402","https://www.scopus.com/pages/publications/85180594105?origin=resultslist","This study, grounded in Control Value Theory, aimed at increasing insight into how the emotions of enjoyment and anxiety shape students' situated math competence beliefs. Additionally, we investigated gender differences in these effects. An online survey including mathematical problems with corresponding competence belief ratings, and questionnaires regarding math-related emotions was filled out by 866 ninth-grade students. Ordinal mixed effects modelling revealed that after correcting for actual performance, emotions contributed (modestly) to students' competence beliefs: enjoyment was positively related to competence and anxiety had a negative relation. The strength of these relations was not affected by gender, but boys did report higher situated math competence beliefs than girls, despite a lack of gender difference in actual performance. Boys also showed higher math enjoyment and lower anxiety than girls. Our findings underline the need for interventions that improve girls' attitude towards mathematics and refute the math gender stereotype. Educational relevance and implications statement: In this study we investigated factors related to ninth-grade students' situated competence beliefs in math. We found that first and foremost actual performance predicted competence beliefs, showing students' metacognitive abilities. But we also found that the emotions of math enjoyment and math anxiety affected these beliefs, and that boys held higher competence beliefs than girls, while their math performance did not differ. This suggests that a situated intervention, aimed at showing girls at the item level how often their answers are correct and stimulating them to hold positive beliefs could boost their confidence in their STEM abilities, and possibly enhance their motivation to pursue a STEM career. © 2023 The Authors","Emotions; Gender; Mathematics; Situated competence beliefs","","Article","Final","All Open Access; Green Open Access; Hybrid Gold Open Access","Scopus","2-s2.0-85180594105"
"Niu J.; Xu H.; Yu J.","Niu, Jinpeng (58090359000); Xu, Hui (57925179400); Yu, Jiangtao (59564658600)","58090359000; 57925179400; 59564658600","Identifying multilevel factors on student mathematics performance for Singapore, Korea, Finland, and Denmark in PISA 2022: considering individualistic versus collectivistic cultures","2025","Humanities and Social Sciences Communications","12","1","151","","","14","10.1057/s41599-025-04466-y","https://www.scopus.com/pages/publications/85218224003?origin=resultslist","Employing a two-level hierarchical linear modelling (HLM) analysis, the current study comparatively explored the effects of student- and school-level factors on student mathematics performance for Singapore, Korea, Finland, and Denmark in the 2022 Programme for International Student Assessment (PISA). The results showed that (a) economic, social and cultural status (ESCS), school average ESCS, mathematics self-efficacy, and mathematics anxiety are significantly associated with mathematics performance for Singapore, Korea, Finland, and Denmark; (b) mathematics teacher support has a significantly positive effect on mathematics performance for Finland and Denmark, while ability grouping for mathematics classes and student disruptive behaviours have a significantly negative impact on mathematics performance for Singapore and Korea; (c) the relationship between time in mathematics homework and mathematics performance is positive in Singapore and Korea but negative in Finland and Denmark; as well, (d) curiosity is positively related to mathematics performance for Korea, Finland, and Denmark, while the influence of mathematics motivation on mathematics performance is only significant for Finland and the influence of mathematics extra-curricular activities on mathematics performance is merely significant for Korea. In essence, the different effects may be associated with intrinsic discrepancies regarding educationally tight versus loose systems, as well as comparatively, regarding philosophically social versus individual orientations, which represent Eastern and Western cultures, respectively. The findings were discussed from a cross-cultural perspective in terms of individualism-collectivism. © The Author(s) 2025.","","","Article","Final","All Open Access; Gold Open Access; Green Open Access","Scopus","2-s2.0-85218224003"
"Milovanović I.; Branovački B.","Milovanović, Ilija (56496660100); Branovački, Bojan (57204969976)","56496660100; 57204969976","Adaptation and Psychometric Evaluation of Modified Abbreviated Math Anxiety Scale for Children in Serbia","2021","International Journal of Science and Mathematics Education","19","3","","579","598","10","10.1007/s10763-020-10066-w","https://www.scopus.com/pages/publications/85082812043?origin=resultslist","Previous research of math anxiety (MA) was largely concerned with the population of high school students. Although there are findings on the existence of MA at early primary school age, a very small number of questionnaires or scales, which have been validated in several cultures and can be used in research with children of this age, have been detected in the literature. The aim of this research was the psychometric evaluation and short validation of Modified Abbreviated Math Anxiety Scale (mAMAS) for children in Serbia. The study was conducted on a sample of 301 early elementary school students from Serbia (mean age 8.79 years). The results of the research indicate a 2-factor solution of this scale. Both components, Math Evaluation Anxiety and Math Learning Anxiety, have satisfactory reliability coefficients and negative relations with math grades. Additionally, there were no detected gender differences on these measures. IRT analysis indicates that both components show satisfactory psychometric properties and all of the items show significant contributions to their respective scales. Both scales exhibit similar properties in that they offer precise discrimination of respondents with average and higher MA levels, which is encouraging as the scale could be used as a screening tool for children who experience problems with MA. © 2020, Ministry of Science and Technology, Taiwan.","Early elementary school children; IRT analysis; mAMAS; Math anxiety; Psychometric evaluation","","Article","Final","","Scopus","2-s2.0-85082812043"
"Bye J.K.; Chan J.Y.-C.; Closser A.H.; Lee J.-E.; Shaw S.T.; Ottmar E.R.","Bye, Jeffrey Kramer (57114749800); Chan, Jenny Yun-Chen (57189031558); Closser, Avery H. (57265979800); Lee, Ji-Eun (57221622712); Shaw, Stacy T. (57201526171); Ottmar, Erin R. (55634752900)","57114749800; 57189031558; 57265979800; 57221622712; 57201526171; 55634752900","Perceiving Precedence: Order of Operations Errors Are Predicted by Perception of Equivalent Expressions","2024","Journal of Numerical Cognition","10","","e14103","","","4","10.5964/jnc.14103","https://www.scopus.com/pages/publications/85217069736?origin=resultslist","Students often perform arithmetic using rigid problem-solving strategies that involve left-to-right-calculations. However, as students progress from arithmetic to algebra, entrenchment in rigid problem-solving strategies can negatively impact performance as students experience varied problem representations that sometimes conflict with the order of precedence (the order of operations). Research has shown that the syntactic structure of problems, and students’ perceptual processes, are involved in mathematics performance and developing fluency with precedence. We examined 837 U.S. middle schoolers’ propensity for precedence errors on six problems in an online mathematics game. We included an algebra knowledge assessment, math anxiety measure, and a perceptual math equivalence task measuring quick detection of equivalent expressions as predictors of students’ precedence errors. We found that students made more precedence errors when the leftmost operation was invalid (addition followed by multiplication). Individual difference analyses revealed that students varied in propensity for precedence errors, which was better predicted by students’ performance on the perceptual math equivalence task than by their algebra knowledge or math anxiety. Students’ performance on the perceptual task and interactive game provide rich insights into their real-time understanding of precedence and the role of perceptual processes in equation solving. © 2024, PsychOpen. All rights reserved.","arithmetic; educational technology; individual differences; math equivalence; order of operations; perceptual learning; precedence","","Article","Final","All Open Access; Gold Open Access; Green Open Access","Scopus","2-s2.0-85217069736"
"Cho K.W.","Cho, Kit W. (55370093100)","55370093100","Tackling Math Anxiety: Are Short Interventions Effective?","2026","Journal of Experimental Education","","","","","","0","10.1080/00220973.2026.2666579","https://www.scopus.com/pages/publications/105037790086?origin=resultslist","Math anxiety is widespread and can have many consequential effects on one’s life. Extensive research has reported a strong negative association between math anxiety and math achievement. This relationship impacts students of all grade levels. Two of the most common short interventions to mitigate math anxiety and bolster math achievement are arousal reappraisal and expressive writing. The present preregistered study sought to replicate and extend seminal findings in the arousal reappraisal and expressive writing literature to improve math performance. Compared to a control condition in which participants wrote about what they did yesterday, participants who learned about how arousal can be used to facilitate rather than hinder performance (arousal reappraisal) or expressed their worries about an upcoming math assessment (expressive writing) failed to improve their performance on a math assessment compared to the control condition. Furthermore, these interventions did not affect participants’ subjective assessments of their performance on the math task or their discomfort with it. No differences were observed when considering participants’ prior math anxiety levels, the difficulty of the math problems, or socioeconomic status. Teachers and practitioners may seek a “quick fix,” but overcoming math anxiety will likely require a consistent and concentrated effort. © 2026 Taylor & Francis Group, LLC.","Arousal reappraisal; expressive writing; math achievement; math anxiety; math learning","","Article","Article in press","","Scopus","2-s2.0-105037790086"
"Ukaj L.; Mehmeti F.","Ukaj, Lekë (58733778600); Mehmeti, Fatmir (58201928800)","58733778600; 58201928800","Beliefs about mathematics and achievement among Kosovar students: Examining the mediating role of curiosity and mathematics anxiety; [PREPRIČANJA O MATEMATIKI IN DOSEŽKI MED KOSOVSKIMI UČENCI: PROUČEVANJE MEDIATORSKE VLOGE RADOVEDNOSTI IN MATEMATIČNE TESNOBE]","2025","Sodobna Pedagogika/Journal of Contemporary Educational Studies","76(142)","4","","146","164","0","10.63384/spB54z827a","https://www.scopus.com/pages/publications/105027747213?origin=resultslist","This study examines the mediating roles of curiosity and mathematics anxiety in the relationship between students’ beliefs about mathematics and their mathematics achievement using structural equation modelling analysis. A quantitative research design was adopted, and the data were analysed using Mplus and IBM SPSS. The representative sample comprised 6,027 Kosovar students drawn from the PISA 2022 database. The dependent variable was the mathematics scores earned by Kosovar students in PISA 2022. The independent variables include the items from the PISA 2022 Student Questionnaire: ‘beliefs about mathematics’ and the mediators ‘curiosity’ and ‘anxiety’. The results revealed that strong beliefs about mathematics positively influence achievement, and curiosity also has a positive effect, whereas mathematics anxiety negatively affects achievement. Furthermore, both curiosity and anxiety mediate the relationship between beliefs about mathematics and mathematics achievement. © 2025, Association of Slovenian Educationalists. All rights reserved.","anxiety; beliefs about mathematics; curiosity; mathematics achievement; PISA 2022","","Article","Final","All Open Access; Hybrid Gold Open Access","Scopus","2-s2.0-105027747213"
"Justicia-Galiano M.J.; Martín-Puga M.E.; Linares R.; Pelegrina S.","Justicia-Galiano, M. José (57021712700); Martín-Puga, M. Eva (56336850600); Linares, Rocío (57162812600); Pelegrina, Santiago (6507647052)","57021712700; 56336850600; 57162812600; 6507647052","Gender stereotypes about math anxiety: Ability and emotional components","2023","Learning and Individual Differences","105","","102316","","","23","10.1016/j.lindif.2023.102316","https://www.scopus.com/pages/publications/85161010885?origin=resultslist","Gender stereotypes are believed to play a role in the heightened math anxiety (MA) reported by female students. We investigated, first, whether adolescents hold the stereotyped beliefs that girls experience more MA than boys (emotional facet), and that boys perform better in math (ability facet); second, whether gender differences in MA are due to self-report bias; and, third, whether gender differences in MA are related to gender-stereotyped beliefs, in terms of both ability and emotional facets. A total of 257 secondary school students completed math-related and gender stereotype measures. The results revealed that female students were perceived as being more prone to MA than male students, but no self-report bias was observed. Regarding the math ability facet, students endorsed either egalitarian or female-favoring views. Finally, gender differences in MA, as well as other math-related performance measures, were related to gender stereotypes about math ability, but not about emotion. © 2023 The Author(s)","Emotion gender stereotypes; Gender differences; Gender stereotypes; Math achievement; Math anxiety; Math gender stereotypes","","Article","Final","All Open Access; Hybrid Gold Open Access","Scopus","2-s2.0-85161010885"
"Doz D.; Doz E.","Doz, Daniel (57210118284); Doz, Eleonora (57225918601)","57210118284; 57225918601","The Impact of COVID-19 Distance Learning on Students’ Math Anxiety: An Exploratory Study","2023","International Journal of Education in Mathematics, Science and Technology","11","1","","1","16","9","10.46328/ijemst.2219","https://www.scopus.com/pages/publications/85144691600?origin=resultslist","In spring 2020, the COVID-19 pandemic forced a rapid shift to distance learning worldwide. Although recent research has focused on the impact that this transition had on students’ education and well-being, little has been done in particular on math education and on math anxiety (MA). Since MA is believed to be linked to the teaching methods, it could be hypothesized that the new learning environment affected MA levels. Thus, this study investigated whether students’ levels of MA evaluated before and during the first wave of the pandemic changed as a consequence of the distance learning implementation. Moreover, we were interested in investigating whether students’ satisfaction with the teaching methods, their effort in math, and their academic achievement were correlated to MA before and during the COVID-19 distance learning. Participants were 117 Italian middle and high school students. No significant differences between pre- and mid-pandemic MA were found when considering the entire sample. Analyzing separately, results indicated that high-MA students reported significantly lower MA levels during distance learning, however no difference was observed for moderate- and low-MA individuals. Furthermore, satisfaction with the teaching methods, effort in math, and math achievement were negatively correlated with MA, both before and during distance education. © 2023 International Journal of Education in Mathematics, Science and Technology. All rights reserved.","COVID-19; Distance learning; Math anxiety; Mathematics; Quarantine","","Article","Final","All Open Access; Gold Open Access","Scopus","2-s2.0-85144691600"
"Pei Y.; Poon K.K.; Suen A.","Pei, Yiru (57363714900); Poon, Kin Keung (12769675200); Suen, Anthony (54973637600)","57363714900; 12769675200; 54973637600","Influence of mathematics anxiety on mathematics performance: mediating effects of mathematical engagement","2026","Mathematics Education Research Journal","38","2","","485","509","1","10.1007/s13394-025-00536-1","https://www.scopus.com/pages/publications/105012406387?origin=resultslist","Mathematics anxiety and mathematical engagement are influencing factors on the mathematical achievement of students. In this study, self-report questionnaires from 409 students from three compulsory education schools in Mainland China were used to quantitatively investigate their mathematics anxiety, mathematical engagement and mathematics performance, and their relationships were explored. The factors representing the mediating effect of mathematical engagement include behavioural, emotional, cognitive and social aspects. The results of the descriptive statistics, t test, correlation analysis and mediation analysis reveal the following: (1) students’ mathematical engagement is high, their anxiety is low, and their academic performance is good; (2) the higher the grade level of a student, the greater the level of mathematics anxiety and the lower their level of engagement; (3) female students have significantly higher social engagement than male students; (4) anxiety is negatively correlated with engagement and performance, whereas engagement is positively correlated with performance; and (5) the direct effect of mathematics anxiety on performance is not significant after controlling for mathematical engagement. The indirect effect of mathematics anxiety on performance via behavioural engagement and cognitive engagement is significant; conversely, emotional engagement and social engagement do not have this effect. The findings offer possible reasons and potential effective teaching strategies for compulsory-stage mathematical educators, which can help them improve their students’ mathematics performance from multiple perspectives. © Mathematics Education Research Group of Australasia, Inc. 2025.","97C; 97C20; Mathematical engagement; Mathematics anxiety; Mathematics teaching and learning; Mediating effect","","Article","Final","","Scopus","2-s2.0-105012406387"
"Lennon-Maslin M.; Quaiser-Pohl C.M.","Lennon-Maslin, Michelle (58411947500); Quaiser-Pohl, Claudia Michaela (24544568100)","58411947500; 24544568100","“It’s Different for Girls!” The Role of Anxiety, Physiological Arousal, and Subject Preferences in Primary School Children’s Math and Mental Rotation Performance","2024","Behavioral Sciences","14","9","809","","","2","10.3390/bs14090809","https://www.scopus.com/pages/publications/85205217038?origin=resultslist","(1) Background: This study examines the role of subjective anxiety (mathematics and spatial anxiety), along with physiological responses, in mathematics or math and mental rotation performance in 131 German primary school students (65 girls, 66 boys; Mean age = 8.73 years). (2) Method: Students’ preference for math vs. German and their subjective anxiety were assessed using standardized questionnaires. Emotional reactivity was measured using the Galvanic Skin Response (GSR). Math performance was evaluated via percentage scored and completion times on number line estimation, word problems, and missing terms tasks. Spatial skills were assessed using a novel mental rotation task (nMRT) incorporating gender-congruent and -neutral stimuli. (3) Results: Girls outperformed boys on percentage scored on the math task but took longer to complete this. No gender differences were found in performance on the nMRT. Girls demonstrated higher math anxiety and were less likely to prefer math over German. Math anxiety predicted math scores and accuracy on the nMRT while gender predicted math performance and mental rotation response time. Subject preference was associated with longer completion times and emotional reactivity with longer response times. Girls’ preference for math and lower emotional reactivity was linked to shorter completion times, while lower math anxiety predicted higher scores. In contrast, these factors did not affect boys’ math performance. Additionally, subjective anxiety, emotional reactivity, or subject preference did not impact spatial performance for either gender. (4) Conclusions: Supporting mathematical self-efficacy and emotional regulation, especially in girls, is crucial for enhancing STEM outcomes in primary education. Gender-fair assessment in mental rotation reveals equitable spatial performance and reduces the impact of anxiety. © 2024 by the authors.","gender differences; math anxiety; math performance; mental rotation skills; physiological arousal; primary education","","Article","Final","All Open Access; Gold Open Access; Green Open Access","Scopus","2-s2.0-85205217038"
"Zhou D.; Liu J.; Wang T.; Liu J.; Li G.","Zhou, Da (57212169793); Liu, Jinqing (57207996488); Wang, Ting (57393132300); Liu, Jian (57195056427); Li, Gang (57392682600)","57212169793; 57207996488; 57393132300; 57195056427; 57392682600","Relationships among problematic smartphone use, mathematics anxiety, learning interest, and achievement: A multiple mediation model","2022","Computers in Human Behavior","129","","107171","","","26","10.1016/j.chb.2021.107171","https://www.scopus.com/pages/publications/85122078527?origin=resultslist","This study examined the mediating roles of mathematics anxiety and learning interest between problematic smartphone use and mathematics achievement. After two-stage stratified sampling, 30,601 Chinese fourth-graders participated by completing a paper-based test on mathematics achievement and an online questionnaire that included questions on demographic information as well as the problematic smartphone use, mathematics anxiety, and mathematics learning interest scales. The results showed that (1) smartphone use was more problematic among boys than among girls, and students with a low SES tended to be more problematic smartphone users, (2) problematic smartphone use was negatively correlated with mathematics achievement, (3) mathematics anxiety and learning interest partially mediated the relationship between problematic smartphone use and mathematics achievement, and (4) the relationship between problematic smartphone use and mathematics achievement was serially mediated by mathematics anxiety and then mathematics learning interest. The implications of this study and suggestions for future research are discussed. © 2021 Elsevier Ltd","Mathematics achievement; Mathematics anxiety; Mathematics learning interest; Problematic smartphone use","Human computer interaction; Mathematic achievement; Mathematic anxiety; Mathematic learning interest; Mathematics learning; Mediating roles; Online questionnaire; Paper-based test; Problematic smartphone use; Smart phones; Stratified sampling; Smartphones","Article","Final","","Scopus","2-s2.0-85122078527"
