"Authors","Author full names","Author(s) ID","Title","Year","Source title","Volume","Issue","Art. No.","Page start","Page end","Cited by","DOI","Link","Abstract","Author Keywords","Index Keywords","Document Type","Publication Stage","Open Access","Source","EID"
"Skagerlund K.; Karlsson A.M.C.; Skagenholt M.; Träff U.","Skagerlund, Kenny (56285657700); Karlsson, Anna M.C. (60141745900); Skagenholt, Mikael (57202735213); Träff, Ulf (55683368200)","56285657700; 60141745900; 57202735213; 55683368200","Mathematics anxiety and emotion regulation: A Swedish validation of the modified Abbreviated Mathematics Anxiety Scale, its relationship to mathematics performance, and emotion regulation strategies","2025","Scandinavian Journal of Educational Research","","","","","","0","10.1080/00313831.2025.2559280","https://www.scopus.com/pages/publications/105018825121?origin=resultslist","Mathematics anxiety (MA) has a severe effect on students’ ability to learn mathematics. The current study assessed the reliability and validity of a Swedish translation of the modified Abbreviated Mathematics Anxiety Scale (mAMAS) in a sample (N = 449) of 12-year-olds. The study also investigated the relationship between MA and emotion regulation strategies, suggested to play an important role in mitigating the negative effects of MA. Using a confirmatory factor analysis (CFA), we find a model of mAMAS with good fit and reliability. The results show similar negative associations between MA, math performance, and gender as in previous research, indicating that the translated version of mAMAS is a valid instrument to use in a Swedish school setting. Novel results include the association between self-reported use of cognitive reappraisal strategies and MA, which informs us about the mechanisms behind how MA may develop and how we can mitigate these negative effects. © 2025 The Author(s). Published by Informa UK Limited, trading as Taylor & Francis Group.","cognitive reappraisal; emotion regulation strategies; math performance; mathematics; Mathematics anxiety","","Article","Article in press","All Open Access; Green Open Access; Hybrid Gold Open Access","Scopus","2-s2.0-105018825121"
"Sancar E.; Özkaya M.","Sancar, Esmanur (59452971200); Özkaya, Merve (57224695607)","59452971200; 57224695607","ERROR-BASED ACTIVITY APPLICATIONS IN SIXTH GRADE FRACTION TEACHING","2024","Studia Paedagogica","29","2","","33","65","0","10.5817/SP2024-2-2","https://www.scopus.com/pages/publications/85210748006?origin=resultslist","This study aims to determine how the error-based activity (EBA) applications used in teaching fractions to sixth-grade students affect the academic achievement of the students, the perceived error climate in the classroom, student math anxiety levels, the permanence of the knowledge, and student views on the EBA applications. In the quantitative part of this research, a mixed-method study, a quasi-experimental design with a pretest-posttest control group was used to examine the effects of EBA applications on math achievement, math anxiety levels, classroom error climate, and permanence. A purposive sampling method was used to collect the quantitative data for the study. In the qualitative part of this research, a case study, semi-structured interviews were conducted with nine volunteers from the experimental group to determine the student views of EBA practices. Analyzing the data obtained showed that EBA had a positive effect on student success, positively affected the perceived error climate in the classroom, and effectively reduced student math anxiety levels and made the knowledge permanent. Apart from this, the results indicated that EBA applications positively affect students in terms of cognitive and affective aspects, increase the quality of teaching, and can be effective in different subjects and courses. © 2024 Masaryk University. All rights reserved.","classroom error climate; error orientation; error-based activity; fractions; math anxiety","","Article","Final","All Open Access; Gold Open Access","Scopus","2-s2.0-85210748006"
"Hunt T.E.; Maloney E.A.","Hunt, Thomas E. (54393367500); Maloney, Erin A. (26667063000)","54393367500; 26667063000","Appraisals of previous math experiences play an important role in math anxiety","2022","Annals of the New York Academy of Sciences","1515","1","","143","154","20","10.1111/nyas.14805","https://www.scopus.com/pages/publications/85138458131?origin=resultslist","Math anxiety affects many people, from young children through to older adults. While there has been debate concerning the developmental trajectory of math anxiety and negative math attitudes, little attention has been given to the role of appraisals of previous math experiences. We surveyed 308 adults (mean age = 27.56 years, SD = 11.25) and assessed self-reported measures of math anxiety, mathematical resilience, math attitudes, and appraisal of previous math experiences. As hypothesized, all variables were found to be interrelated. Math anxiety was significantly negatively related to appraisal of previous math experiences, mathematical resilience, and math attitudes. Moreover, appraisal of previous math experiences was shown to mediate the relations between (1) math anxiety and math attitudes, and (2) mathematical resilience and math attitudes. The findings demonstrate the importance of considering current appraisals of previous math experiences and are consistent with an interpretation account of math anxiety. This may help inform cognitive-based interventions that focus on one's interpretation of past events to support current and future math learning and engagement. © 2022 The Authors. Annals of the New York Academy of Sciences published by Wiley Periodicals LLC on behalf of New York Academy of Sciences.","appraisal; interpretation account; math anxiety; math attitudes; mathematical resilience","Adult; Aged; Anxiety; Anxiety Disorders; Attention; Child; Child, Preschool; Humans; Mathematics; adult; aged; anxiety; article; controlled study; female; human; learning; major clinical study; male; anxiety disorder; attention; child; mathematics; preschool child","Article","Final","All Open Access; Green Open Access; Hybrid Gold Open Access","Scopus","2-s2.0-85138458131"
"Tamal M.A.; Akter R.; Hossain S.A.; Rezaul K.M.","Tamal, Maruf Ahmed (57214225033); Akter, Rabia (57223985094); Hossain, Syed Akhter (57197918832); Rezaul, Karim Mohammed (6506837594)","57214225033; 57223985094; 57197918832; 6506837594","A Weighted Scoring Based Rating Scale to Identify the Severity Level of Mathematics Anxiety in Students","2021","International Journal of Interactive Mobile Technologies","15","8","","18","30","7","10.3991/ijim.v15i08.18627","https://www.scopus.com/pages/publications/85106666300?origin=resultslist","Mathematics Anxiety (MA) is a pessimistic emotional attitude towards math that negatively affects mathematics learning. Due to its adverse impacts on students, assessing Mathematics Anxiety (MA) in early-stage has become a burning need over time. Generally, the existing measures of assessing MA adopt primitive questionnaires, and unweighted rating scale based approaches designed for students’ particular age range. As a consequence, this type of scale is not sufficient enough to use widely. To bridge this gap, considering 839 students, the present study has proposed a Weighted Scoring Based Mathematics Anxiety Rating Scale (WSB-MARS). The reliability and validity of the WSB-MARS were ensured by high item-internal consistency, 1-week test-retest reliability, and the expert panel (validity). The study’s overall findings suggest that WSB-MARS is a reliable, valid, generalized scale to assess the severity level of mathematics anxiety in students. Besides, the proposed scale could be implemented as a mobile application system that may help teachers/guardians recognize the effective intervention techniques for alleviating mathematics anxiety. © 2021","assessment; math learning; Mathematics anxiety; mathematics anxiety rating scale","","Article","Final","All Open Access; Gold Open Access","Scopus","2-s2.0-85106666300"
"Casanova S.; Vukovic R.K.; Kieffer M.J.","Casanova, Saskias (55309185200); Vukovic, Rose K. (8101653200); Kieffer, Michael J. (22951145600)","55309185200; 8101653200; 22951145600","Do girls pay an unequal price? Black and Latina girls' math attitudes, math anxiety, and mathematics achievement","2021","Journal of Applied Developmental Psychology","73","","101256","","","12","10.1016/j.appdev.2021.101256","https://www.scopus.com/pages/publications/85100701531?origin=resultslist","This study examined the longitudinal relation between math attitudes and math anxiety in first grade (Mage = 6 years, 10 months) and mathematics achievement in fourth grade (Mage = 9 years, 11 months) for 155 Black and Latinx children. Multi-group structural equation modeling showed an inverse relation between math attitudes and math anxiety in first grade for boys and girls. Although there were no mean differences in math anxiety between boys and girls, there was a significant difference in its longitudinal relation with mathematics achievement: for girls, but not boys, first grade math anxiety negatively predicted fourth grade mathematics achievement, controlling for earlier achievement. Math anxiety longitudinally contributes to minoritized girls' long-term mathematics achievement. Teachers should be knowledgeable about the relation between math anxiety and math attitudes and be more responsive to Black and Latinx girls' mathematical learning needs to provide them equitable opportunities to be successful in mathematics. © 2021 Elsevier Inc.","Black; Gender; Latinx; Math anxiety; Math attitudes; Mathematics achievement","","Article","Final","","Scopus","2-s2.0-85100701531"
"Adelabu F.M.; Mudadigwa B.","Adelabu, Folake Modupe (57208884375); Mudadigwa, Brighton (57212167617)","57208884375; 57212167617","Determining Mathematics Anxiety Levels Among Foundation-Phase Student Teachers","2025","International Journal of Interdisciplinary Educational Studies","20","2","","225","245","0","10.18848/2327-011X/CGP/v20i02/225-245","https://www.scopus.com/pages/publications/85219030217?origin=resultslist","This study aims to determine mathematics anxiety among foundation-phase student teachers. The method used in this study is a quantitative research approach. Data for the study was collected using a closed questionnaire, which linked to mathematics anxiety scales adapted from Betz. Forty-seven foundation-phase mathematics student teachers participated in the study. Purposive sampling was used to select the sample for the study. Data were analyzed using descriptive statistics to determine the mathematics anxiety levels of the student teachers. The differences in anxiety levels in mathematics between male and female foundation-phase student teachers were tested using a one-sample t-test. The findings of the study revealed that many of the students were nervous about making a mistake anytime they were doing mathematics; half of the respondents were always worried that they did not know enough mathematics to do well in future mathematics courses. In addition, most of the student teachers had moderate mathematics anxiety, while one-third had low and very few students had high levels of mathematics anxiety. A t-test showed significant difference between male and female students mathematics anxiety, with female student teachers showing lower mathematics anxiety than the male student teachers. These results showed that student teachers experience varying levels of mathematics anxiety, which impacts on their understanding in mathematics and is a barrier to learning mathematics. Therefore, this study suggests that there should be an introduction of mathematics intervention such as computer software for learning mathematics which can assist and motivate the students to learn mathematics. © 2025 Common Ground Research Networks. All rights reserved.","Foundation-phase Student Teachers; Mathematics Anxiety; Mathematics Performance; Student Mathematics Learning; Student Performance","","Article","Final","All Open Access; Hybrid Gold Open Access","Scopus","2-s2.0-85219030217"
"Doz E.; Cuder A.; Pellizzoni S.; Granello F.; Passolunghi M.C.","Doz, Eleonora (57225918601); Cuder, Alessandro (57256567700); Pellizzoni, Sandra (25960946300); Granello, Federica (59202460700); Passolunghi, Maria Chiara (56047533700)","57225918601; 57256567700; 25960946300; 59202460700; 56047533700","The interplay between ego-resiliency, math anxiety and working memory in math achievement","2024","Psychological Research","88","8","","2401","2415","10","10.1007/s00426-024-01995-0","https://www.scopus.com/pages/publications/85197381908?origin=resultslist","Previous research has suggested that math anxiety may contribute to poor math performance by interfering with working memory. However, only a limited number of studies investigated the mediating role of working memory in the math anxiety-math performance link in school-aged children. Unlike math anxiety, ego-resiliency is a personality resource that promotes the management of challenges and has been positively associated with math performance and negatively with anxiety. Nevertheless, there is still limited understanding regarding the specific role of ego-resiliency in math learning and how it relates to math anxiety. This study aimed to investigate conjunctly the interplay between primary school children’s ego-resiliency, math anxiety, working memory, and performance on two different math tasks (i.e., arithmetic task and word problem-solving task), after controlling for general anxiety and age. The study involved 185 Italian children from grades 3 to 5. Serial multi-mediational analyses revealed that: (1) ego-resiliency has a positive indirect effect on math achievement through two paths - math anxiety, and math anxiety and working memory; (2) the study replicated previous findings showing that working memory partially mediated the relationship between math anxiety and math performance; (3) similar patterns of results were found for both math skills. The study identifies ego-resiliency as a possible protective factor in the development of math anxiety and suggests that ego-resiliency could be worth considering when designing interventions aimed at reducing negative emotions towards mathematics. © The Author(s) 2024.","Ego-resiliency; Math anxiety; Math performance; Primary school; Word problems; Working memory","Academic Success; Anxiety; Child; Ego; Female; Humans; Male; Mathematics; Memory, Short-Term; Problem Solving; Resilience, Psychological; academic success; anxiety; child; ego; female; human; male; mathematics; physiology; problem solving; psychological resilience; psychology; short term memory","Article","Final","All Open Access; Green Open Access; Hybrid Gold Open Access","Scopus","2-s2.0-85197381908"
"Zuo S.; Huang Q.; Qi C.","Zuo, Siyu (58032278800); Huang, Qi (57575444900); Qi, Chunxia (55389307100)","58032278800; 57575444900; 55389307100","The relationship between cognitive activation and mathematics achievement: mediating roles of self-efficacy and mathematics anxiety","2024","Current Psychology","43","39","","30794","30805","14","10.1007/s12144-024-06700-3","https://www.scopus.com/pages/publications/85209827769?origin=resultslist","This study explores the connection of cognitive activation, self-efficacy, and mathematics anxiety in shaping eighth-grade students’ mathematics achievement. Analysing data from a comprehensive survey involving 17,112 students across 91 schools in China, our study uncovers insights: (1) Cognitive activation significantly and directly influences mathematics achievement; (2) The positive impact of cognitive activation on mathematics achievement is primarily mediated by self-efficacy; (3) Mathematics anxiety partially mediates the link between cognitive activation and mathematics achievement; and (4) Sequentially, self-efficacy and mathematics anxiety act as mediators in the relationship between cognitive activation and mathematics achievement. The implications for mathematics educators are discussed, and avenues for future research are suggested. © The Author(s), under exclusive licence to Springer Science+Business Media, LLC, part of Springer Nature 2024.","Cognitive activation; Mathematics achievement; Mathematics anxiety; Self-efficacy","","Article","Final","","Scopus","2-s2.0-85209827769"
"Pellizzoni S.; Cargnelutti E.; Cuder A.; Passolunghi M.C.","Pellizzoni, Sandra (25960946300); Cargnelutti, Elisa (56338669300); Cuder, Alessandro (57256567700); Passolunghi, Maria Chiara (56047533700)","25960946300; 56338669300; 57256567700; 56047533700","The interplay between math anxiety and working memory on math performance: a longitudinal study","2022","Annals of the New York Academy of Sciences","1510","1","","132","144","34","10.1111/nyas.14722","https://www.scopus.com/pages/publications/85128102956?origin=resultslist","Mathematical skills are essential to mastering everyday activities, making professional choices, and exercising citizenship in a numerate society. There is extensive evidence of the relationship between math anxiety (MA) and working memory (WM) influencing math attainment. Studies have mainly considered adult samples, however, leaving primary school children almost unexplored. This study is a first attempt to examine how the complex interplay between MA and WM affects math achievement from a developmental perspective. A total of 148 third graders were assessed with WM, general anxiety (GA), MA, and math tasks. Anxiety and WM were assessed at the beginning of the school year when children started attending grade 3, while math achievement was tested twice at the start of grades 3 and 4. The findings seem to confirm that GA has both a direct and an indirect effect (mediated by WM) on math performance in third and fourth graders. MA has a direct effect on math performance in grade 4, but only an indirect effect in grade 3, suggesting MA has a developmental trajectory, becoming stronger over time. The implications in the educational setting are discussed, pointing to the importance of a combined intervention on MA and WM. © 2021 The Authors. Annals of the New York Academy of Sciences published by Wiley Periodicals LLC on behalf of New York Academy of Sciences.","cognitive factors; developmental trajectories; math anxiety; math learning; working memory","Adult; Anxiety; Anxiety Disorders; Child; Humans; Longitudinal Studies; Mathematics; Memory, Short-Term; achievement; anxiety; article; female; human; learning; longitudinal study; male; working memory; adult; anxiety; anxiety disorder; child; longitudinal study; mathematics; short term memory","Article","Final","All Open Access; Green Open Access; Hybrid Gold Open Access","Scopus","2-s2.0-85128102956"
"Tang J.; Su Y.; Yao Y.; Peyre H.; Guez A.; Zhao J.","Tang, Jiuqing (57222321725); Su, Yun (57222315291); Yao, Yu'e (57222327176); Peyre, Hugo (35782457900); Guez, Ava (57202287594); Zhao, Jingjing (57221069953)","57222321725; 57222315291; 57222327176; 35782457900; 57202287594; 57221069953","Respiratory Sinus Arrhythmia Mediates the Relation Between “Specific Math Anxiety” and Arithmetic Speed","2021","Frontiers in Psychology","12","","615601","","","5","10.3389/fpsyg.2021.615601","https://www.scopus.com/pages/publications/85102257278?origin=resultslist","There is a growing consensus that math anxiety highly correlates with trait anxiety and that the emotional component elicited by math anxiety affects math performance. Yet few studies have examined the impact of “specific math anxiety” (high math anxiety and low other kinds of anxiety) on math performance and the underlying physiological and affective mechanism. The present study examines the mediation effect of heart rate variability—an affective measurement indexed by respiratory sinus arrhythmia (RSA)—in the relationship between specific math anxiety and arithmetic speed. A total of 386 junior high school students completed a self-reported questionnaire to measure their anxiety level. Among this sample, 29 individuals with specific math anxiety (high math anxiety and low reading and trait anxiety), 29 with specific reading anxiety (high reading anxiety and low math and trait anxiety), 24 with specific trait anxiety (high trait anxiety and low math and reading anxiety), and 22 controls (low math, trait and reading anxiety) were selected to participate in an arithmetic task and a reading task while RSA was recorded when they performed the tasks. Results revealed that individuals with specific math anxiety showed lower RSA and longer reaction time than the other three groups in the arithmetic task. Regression and mediation analyses further revealed that RSA mediated the relation between specific math anxiety and arithmetic speed. The present study provides the first account of evidence for the affective hypothesis of specific math anxiety and suggests that affective responses may be an important mechanism underlying the detrimental effect of specific math anxiety on math performance. © Copyright © 2021 Tang, Su, Yao, Peyre, Guez and Zhao.","affective; arithmetic; math anxiety; physiology; RSA","","Article","Final","All Open Access; Gold Open Access; Green Open Access","Scopus","2-s2.0-85102257278"
"Lei Q.; Liu D.; Chen X.; Hirni M.; Wang J.; Abdelnaby H.; Wei S.","Lei, Qingli (57203300369); Liu, Di (57195033118); Chen, Xiuhan (59910174000); Hirni, Megan (59910330800); Wang, Jing (57573377100); Abdelnaby, Heba (58507496300); Wei, Shuang (55822418000)","57203300369; 57195033118; 59910174000; 59910330800; 57573377100; 58507496300; 55822418000","Mathematics anxiety, trait emotional intelligence, and self-concept: Pathways to mathematics performance in students with and without mathematics learning difficulties","2025","Journal of Research in Special Educational Needs ","25","4","","945","957","3","10.1111/1471-3802.70020","https://www.scopus.com/pages/publications/105005869349?origin=resultslist","This study examined how mathematics anxiety, trait emotional intelligence, and mathematics self-concept predict calculation fluency, numerical operations, and mathematical reasoning in students with and without mathematics learning difficulties (MLD). Participants (N = 326) were third- to fifth-grade students from China who completed standardized mathematics performance assessments and self-report measures of mathematics anxiety and trait emotional intelligence. Structural equation modelling showed that mathematics anxiety negatively influenced all mathematics outcomes, whereas trait emotional intelligence had a positive impact. Mathematics self-concept mediated the effects of mathematics anxiety in the full sample, with partial mediation for calculation fluency and full mediation for mathematical reasoning and numerical operations. No mediation effects were found for students with MLD. These results emphasize the need to address affective and non-cognitive factors in interventions and highlight the critical roles of self-concept and trait emotional intelligence in improving mathematics performance across diverse student populations. © 2025 The Author(s). Journal of Research in Special Educational Needs published by John Wiley & Sons Ltd on behalf of National Association for Special Educational Needs.","mathematics anxiety; mathematics learning difficulties; mathematics self-concept; trait emotional intelligence","","Article","Final","All Open Access; Hybrid Gold Open Access","Scopus","2-s2.0-105005869349"
"Xiao F.; Sun L.","Xiao, Feiya (56346967000); Sun, Li (55493064800)","56346967000; 55493064800","Students’ Motivation and Affection Profiles and Their Relation to Mathematics Achievement, Persistence, and Behaviors","2021","Frontiers in Psychology","11","","533593","","","32","10.3389/fpsyg.2020.533593","https://www.scopus.com/pages/publications/85100260385?origin=resultslist","Objective: We aimed to explore profiles of subgroups of United States students based on their motivational and affective characteristics and investigate the differences in math-related behaviors, persistence, and math achievement across profiles. Method: We used 1,464 United States students (male 743 51%, female 721 49%, age 15.82 ± 0.28) from PISA 2012 United States data in our study. First, we employed latent profile analysis and secondary clustering to identify subgroups of students based on motivational (math self-concept, interest in math, perceived control, and instrumental motivation) and affective factors (math anxiety). Next, we used regression to compare differences in math behavior, persistence, and achievement among all identified subgroups. Results: We found five distinct groups of students with different patterns of motivation and affection. The subgroup of students with the lowest math anxiety and the highest motivation levels showed the highest math achievement and levels of persistence. The groups with high math interest, math self-concept, and instrumental motivation showed the most frequent math-related behaviors. Conclusions: Our findings reveal the complexity of the students’ motivational and affective profiles. Our findings are significant for teachers and educators to understand the diversity of students and provide theoretical and practical support for individualized and differentiated instruction. © Copyright © 2021 Xiao and Sun.","LPA; math achievement; math anxiety; math interest; math self-concept; perceived control in math; persistence","","Article","Final","All Open Access; Gold Open Access; Green Open Access","Scopus","2-s2.0-85100260385"
