"Authors","Author full names","Author(s) ID","Title","Year","Source title","Volume","Issue","Art. No.","Page start","Page end","Cited by","DOI","Link","Abstract","Author Keywords","Index Keywords","Document Type","Publication Stage","Open Access","Source","EID"
"de Vera J.; Tundag M.D.; Codeniera N.J.; Vosotros A.; Ygoña M.; Peteros E.; Sacan E.; Toyco K.S.","de Vera, John (57610891600); Tundag, Maria Divina (60335028200); Codeniera, Niña Joy (60334169700); Vosotros, Avril (60335028300); Ygoña, Marvin (60334026300); Peteros, Emerson (57219873251); Sacan, Emma (59541591000); Toyco, Khaye Sea (60334599300)","57610891600; 60335028200; 60334169700; 60335028300; 60334026300; 57219873251; 59541591000; 60334599300","The mediating role of the student-teacher relationship in mathematics anxiety and achievement among students","2026","Multidisciplinary Reviews","9","7","e2026332","","","0","10.31893/multirev.2026332","https://www.scopus.com/pages/publications/105027581792?origin=resultslist","This research examined the mediating effect of the student-teacher relationship between students’ mathematics anxiety and achievement among Grade 10 students from four selected schools of the Cebu City Division for the school year 2024-2025 as the foundation for a strategic plan using a descriptive-correlational research design. A total of 526 students were selected using simple random sampling, following Cochran’s formula to ensure a representative sample with a 5% margin of error. The data gathered were analyzed using weighted mean, standard deviation, Pearson’s r, and multiple regression analysis. The results indicated that students displayed a moderate level of mathematics anxiety, a strongly positive student-teacher relationship, and satisfactory performance in mathematics. Correlation analysis revealed a negligible negative relationship between mathematics anxiety and achievement, a negligible positive relationship between the student-teacher relationship and achievement, and a negligible negative relationship between mathematics anxiety and the student-teacher relationship. Moreover, the findings suggested that while math anxiety negatively affects students’ performance, a strong student-teacher relationship can serve as a mediating factor in reducing its adverse effects. Thus, these results provide meaningful insights into the development of a strategic plan aimed at improving mathematics achievement through strengthened student-teacher relationships. The study’s outcomes underscore the perspectives of students toward mathematics and their academic performance, which provide valuable implications for supporting and enhancing learning through positive student-teacher interactions. © 2026, Malque Publishing. All rights reserved.","academic motivation; classroom climate; emotional support; learner engagement; teaching effectiveness","","Article","Final","All Open Access; Gold Open Access","Scopus","2-s2.0-105027581792"
"Svraka B.; Lasker J.; Ujma P.P.","Svraka, Bernadett (58114525900); Lasker, Jordan (57211969406); Ujma, Péter Przemyslaw (55937258200)","58114525900; 57211969406; 55937258200","Cognitive, affective and sociological predictors of school performance in mathematics","2024","Scientific Reports","14","1","26480","","","2","10.1038/s41598-024-77904-7","https://www.scopus.com/pages/publications/85208499065?origin=resultslist","Mathematics is a key school subject for some of the most lucrative and economically important careers. Low mathematics performance in school is associated with low psychometric intelligence, family socioeconomic status (SES), specific mathematical abilities, and high mathematics anxiety. We used a sample of Hungarian schoolchildren (N = 102, mean age = 12.3 years) to directly compare the predictive power of general intelligence, specific mathematical abilities measured by the Pedagogical Examination of Dyscalculia (DPV), mathematics anxiety, and socioeconomic status for mathematics grades. Mathematics grades correlated with IQ, specific mathematic ability, mathematics anxiety, and a composite measure of family SES. The WISC-IV showcased a manifest correlation of 0.62 and a latent correlation of 0.78 with the DPV and high manifest (r=-0.53) and latent (r=-0.59) correlations with mathematics anxiety. IQ alone accounted for 52% of the variance in mathematics grades. IQ, specific mathematical ability, family SES and mathematics anxiety jointly accounted for 56% of the variance in grades, with a non-significant contribution of specific mathematical ability and family SES over IQ and a marginal contribution of mathematics anxiety. Our results show that psychometric intelligence is the most important predictor of mathematics grades, while family SES and specific mathematical abilities are only associated with grades to the extent they reflect psychometric intelligence. The results, however, confirmed a small role of mathematics anxiety over intelligence in predicting grades. © The Author(s) 2024.","Dyscalculia; Family SES; General cognitive ability; Mathematics anxiety","Academic Performance; Adolescent; Anxiety; Child; Cognition; Dyscalculia; Female; Humans; Hungary; Intelligence; Male; Mathematics; Psychometrics; Schools; Social Class; academic achievement; adolescent; anxiety; child; cognition; dyscalculia; female; human; Hungary; intelligence; male; mathematics; physiology; procedures; psychology; psychometry; school; social class","Article","Final","All Open Access; Gold Open Access; Green Open Access","Scopus","2-s2.0-85208499065"
"Omar S.H.; Aris S.R.S.; Hoon T.S.","Omar, Siti Hawa (57941933900); Aris, Sharipah Ruzaina Syed (55377749700); Hoon, Teoh Sian (36158220800)","57941933900; 55377749700; 36158220800","Mathematics Anxiety and its Relationship with Mathematics Achievement among Secondary School Students","2022","Asian Journal of University Education","18","4","","863","878","4","10.24191/ajue.v18i4.19992","https://www.scopus.com/pages/publications/85140615458?origin=resultslist","Mathematics attainment has taken on a global focus for the furtherance of economic advancement, thus, magnetising for the appraisal of mathematical edification among school students. However, evidence suggests that mathematics anxiety is a salient contributing factor that obstructs success in mathematics. Drawing upon the evidence, this investigation explores the relationship between mathematics anxiety, performance and strategies that students perceived that could attenuate mathematics anxiety. Data from this study was collected using the mixed method approach of a survey and interview from forty-two Form One students with different levels of academic achievements from one school in Alor Setar, Kedah, Malaysia. All participants demonstrated a moderate level of mathematics anxiety. However, students from the low performance level displayed an inverse and strong relationship between mathematics anxiety and mathematics performance. This indicates that mathematics performance declines with augmented mathematics anxiety. The linear regression revealed that all the three factors of emotion, assessment, and environment are not statistically significant predictors of mathematics achievement. Regardless, emotion has been discerned as a significant predictor of mathematics anxiety for a high performance group of students. The interview revealed that students perceive games, cooperative groups, teaching aids, demonstration, rewards, and teachers with positive classroom attitude have contributed to overcoming mathematics anxiety. Results from this study suggest a strong relationship between anxiety and mathematics performance among low performing students which further indicated the importance for mathematics teachers to vary their teaching and learning activities in assisting students to cope with mathematics anxiety © 2022, Asian Journal of University Education.All Rights Reserved.","Learning activities; Mathematics anxiety; Mathematics performance","","Article","Final","All Open Access; Gold Open Access","Scopus","2-s2.0-85140615458"
"Szczygieł M.","Szczygieł, Monika (57000248500)","57000248500","Math Attitude and Math Anxiety of STEM Students Needs More Attention","2022","Polish Psychological Bulletin","53","3","","203","211","3","10.24425/ppb.2022.141868","https://www.scopus.com/pages/publications/85148031189?origin=resultslist","The issue of math attitude and math anxiety in STEM students has been till now overlooked. However, the issue occurring in many countries is students’ falling out of the STEM education system during their studies. One of the reasons for this problem may be high math anxiety and a negative math attitude among students. The present study fills a gap in knowledge about this phenomenon among STEM students. 371 Polish STEM students filled questionnaires of math attitude (MASA) and math anxiety (MAQA, SIMA, AMAS). The results are as follow: The mean results show that STEM students have a very positive math attitude in affective and cognitive dimensions and a rather positive math attitude in the behavioral area; On average, STEM students feel very weak anxiety related to math problem solving, weak general math anxiety and math learning anxiety, and a moderate level of math testing anxiety; Among STEM students there are those who present a very negative/negative math attitude and very strong/strong math anxiety; Women feel more intense anxiety related to math problem solving, but there is no gender gap in general math anxiety, math learning and math testing anxiety, and in math attitude. The results suggest that math attitude and math anxiety of STEM students should be monitored. Indeed, not all STEM students have a positive math attitude and feel no math anxiety. Moreover, proper interventions are recommended to decrease math anxiety and improve positive math attitude that in turn may prevent the students’ dropping out from STEM studies. © 2022 Polish Academy of Sciences. All rights reserved.","math anxiety; math attitude; STEM education; STEM students","","Article","Final","All Open Access; Gold Open Access","Scopus","2-s2.0-85148031189"
"Kilp-Kabel T.; Mädamürk K.","Kilp-Kabel, Triinu (58896086400); Mädamürk, Kaja (57189874920)","58896086400; 57189874920","Expectancies, values, and task persistence can alleviate the negative effects of math anxiety on math performance","2025","European Journal of Psychology of Education","40","1","17","","","2","10.1007/s10212-024-00928-0","https://www.scopus.com/pages/publications/85210496692?origin=resultslist","The current study was conducted to investigate the relationship between math anxiety and math achievement, highlighting differences in motivation based on age, and the mediating effects of task persistence as well as aspects of the expectancy-value theory. The students in the study (grade five N = 335, grade eight N = 251) were from Estonian schools and completed questionnaires about achievement motivation as well as math tasks during the 2021/2022 school year. Results showed that students in grade eight report lower scores in motivation when compared to students in grade five. Additionally, task persistence mediated the relationship between math anxiety and math achievement in grade five but not in grade eight. Self-efficacy, interest value, and effort cost mediated the relationship between math anxiety and math achievement in both grades five and eight, while attainment value and utility value did not. This indicates that the possible positive cognitive and affective effects aid in relieving, while effort cost may increase the negative effect of anxiety on math achievement. © Instituto Universitário de Ciências Psicológicas, Sociais e da Vida 2024.","Expectancy-value theory; Math achievement; Math anxiety; Motivation; Task persistence","","Article","Final","","Scopus","2-s2.0-85210496692"
"Lu Y.; Li Q.; Patrick H.; Mantzicopoulos P.","Lu, Yaheng (57212308094); Li, Qian (59620819600); Patrick, Helen (7006547153); Mantzicopoulos, Panayota (6603739681)","57212308094; 59620819600; 7006547153; 6603739681","“Math Gives Me a Tummy Ache!” Mathematics Anxiety in Kindergarten","2021","Journal of Experimental Education","89","2","","362","378","23","10.1080/00220973.2019.1680518","https://www.scopus.com/pages/publications/85076441378?origin=resultslist","We report on the construction and validation of the Young Children’s Math Anxiety Scale (YCMAX), a developmentally appropriate measure of math anxiety intended for kindergarten students. We administered the YCMAX to a sample of public school kindergarteners (N = 355) and conducted factor analyses to examine its structure. A two-factor solution (Worry and Somatization) best fit the data. Children with higher, compared to lower, Worry and Somatization scores had lower math achievement, reported feeling less competent at math, liked math less, and were evaluated by their teachers as less interested in and needing more support for learning math. In addition, we documented children’s experiences with math tests using three open-ended questions. More than half of the children (n = 216, 61%) commented on their math tests, including test procedures, test content, and test results. Children who felt negatively about math tests expressed more worry and, particularly, more somatization compared to those with positive feelings about math tests. The results indicated that the YCMAX scores were internally consistent and demonstrated construct validity, thus supporting the instrument’s utility for research on math anxiety in the early grades. © 2019 Taylor & Francis Group, LLC.","math achievement; Math anxiety; measurement; motivation for math; young children","","Article","Final","","Scopus","2-s2.0-85076441378"
"Živković M.; Pellizzoni S.; Doz E.; Cuder A.; Mammarella I.; Passolunghi M.C.","Živković, Marija (57435213000); Pellizzoni, Sandra (25960946300); Doz, Eleonora (57225918601); Cuder, Alessandro (57256567700); Mammarella, Irene (6508143157); Passolunghi, Maria Chiara (56047533700)","57435213000; 25960946300; 57225918601; 57256567700; 6508143157; 56047533700","Math self-efficacy or anxiety? The role of emotional and motivational contribution in math performance","2023","Social Psychology of Education","26","3","","579","601","57","10.1007/s11218-023-09760-8","https://www.scopus.com/pages/publications/85146629610?origin=resultslist","Various studies have highlighted the important influence of math ability in a numerate society. In this study, we investigated the influence of emotional (math anxiety and math enjoyment) and cognitive-motivational (math self-efficacy) factors on math performance. Participants were 145 fifth-grade students (84 boys and 61 girls). The results showed that math performance was negatively correlated with math anxiety and positively correlated with math enjoyment and math self-efficacy. Moreover, math anxiety was negatively associated with enjoyment in math and math self-efficacy, whereas math enjoyment was positively correlated with math self-efficacy. Hierarchical regression analysis showed a significant influence of math anxiety and math self-efficacy on math performance in fifth-grade students. Results are discussed in terms of a new perspective in emotional and motivational factors to train in school contexts. © 2023, The Author(s).","Anxiety; Enjoyment; Math performance; Primary school students; Self-efficacy","","Article","Final","All Open Access; Green Open Access; Hybrid Gold Open Access","Scopus","2-s2.0-85146629610"
"Sánchez-Pérez N.; Fuentes L.J.; González-Salinas C.","Sánchez-Pérez, Noelia (55881343400); Fuentes, Luis J. (7006580513); González-Salinas, Carmen (6507420589)","55881343400; 7006580513; 6507420589","Assessing math anxiety in elementary schoolchildren through a Spanish version of the Scale for Early Mathematics Anxiety (SEMA)","2021","PLoS ONE","16","8 August","e0255777","","","14","10.1371/journal.pone.0255777","https://www.scopus.com/pages/publications/85112130439?origin=resultslist","Math anxiety (MA) affects students of all age groups. Because of its effects on children's academic development, the need to recognize its early manifestations has been highlighted. We designed a European-Spanish version of the Scale for Early Mathematics Anxiety (SEMA; Wu et al. (2012)), and assessed its psychometric properties in a sample of children aged 7 to 12 years. The participants (967 typically developing children) were elementary school students recruited from ten schools. Children reported their general and math anxiety levels in an individual session and performed nonverbal IQ and math abilities subtests in a group session. Teachers reported the final math grades. The psychometric indices obtained, and the resulting factor structure revealed that the European-Spanish version of the SEMA developed in this study is a reliable and valid measure to evaluate MA in children from 3rd to 6th grade. Moreover, we explored gender differences, that resulted in small effect sizes, which disappeared when controlling for trait anxiety. Differences across grades were found for both global MA and the numerical processing anxiety factor but not for the situational and performance anxiety factor. Finally, MA was negatively associated with students' math achievement, although the strength of the associations varied with the MA measure selected, the kind of math achievement analyzed, and the school stage considered. Our findings highlight the relevance of MA in elementary school and highlight the need for an early identification of students at risk of suffering MA to palliate the negative consequences of MA in children's cognitive and academic development. © 2021 Sánchez-Pérez et al. This is an open access article distributed under the terms of the Creative Commons Attribution License, which permits unrestricted use, distribution, and reproduction in any medium, provided the original author and source are credited.","","Child; Cross-Cultural Comparison; Female; Humans; Male; Mathematics; Psychological Tests; Spain; Test Anxiety; achievement; article; child; controlled study; effect size; elementary student; female; human; human tissue; male; mathematics; performance anxiety; school child; sex difference; teacher; cultural factor; diagnosis; psychologic test; psychology; Spain","Article","Final","All Open Access; Gold Open Access; Green Open Access","Scopus","2-s2.0-85112130439"
"Machisi E.; Kurudirek A.","Machisi, Eric (56117235900); Kurudirek, Abdullah (58741598500)","56117235900; 58741598500","Transforming Confusion into Clarity: Employing the Feynman Technique to Overcome Mathematics Anxiety","2026","Mathematics Teaching-Research Journal","18","2","","268","295","0","","https://www.scopus.com/pages/publications/105038839200?origin=resultslist","This study examines the effectiveness of the Feynman Learning Technique (FLT) in improving mathematics performance and reducing math anxiety among tenth-grade students learning about parabolas. A quasi-experimental design was employed, involving 67 students from Erbil, Iraq, who were divided into an experimental and a control group. The experimental group received instruction through FLT, which focuses on learning by teaching, while the control group followed conventional teaching methods. Data were collected using a pretest, post-test, and a modified version of the Abbreviated Math Anxiety Scale. Analysis conducted with Quade’s nonparametric ANCOVA revealed that students taught using FLT significantly outperformed their peers in the control group. Additionally, a Wilcoxon signed-rank test indicated a statistically significant reduction in mathematics anxiety within the experimental group, while anxiety levels increased in the control group. These findings suggest that FLT not only enhances conceptual understanding but also effectively reduces math-related stress. This study recommends that teachers adopt the FLT in mathematics classrooms to promote self-directed learning and enhance students' conceptual understanding and retention of knowledge. Future research should expand on this work by investigating the effectiveness of FLT across various mathematical topics and educational levels. © 2026, City University of New York. All rights reserved.","Feynman Learning Technique; mathematics anxiety; mathematics education","","Article","Final","","Scopus","2-s2.0-105038839200"
"Bergqvist E.","Bergqvist, Erik (57365663700)","57365663700","Relations Between Mathematics Self-Efficacy and Anxiety Beliefs: When Multicollinearity Matters","2025","Journal of Experimental Education","93","3","","565","585","5","10.1080/00220973.2024.2338545","https://www.scopus.com/pages/publications/85190431776?origin=resultslist","This article reports on an investigation among 156 upper secondary students who self-evaluated their general mathematics self-efficacy and anxiety beliefs. After minimizing the influence of extreme multicollinearity, an exploratory factor analysis revealed a clear four-factor pattern. Two of the factors were interpreted as self-concept-like factors; one representing student’s overall confidence in mathematics labeled mathematics self-concept, and the other labeled generalized mathematics self-efficacy, concerned with student’s future-oriented perception of their competence in mathematics. The other two factors are students’ anxiety when they give wrong answers in mathematics class (in-class anxiety), and students’ anxiety and stress when they must do mathematics homework (assignment anxiety). Although no gender differences were found in previous mathematics achievement, the analyses indicated that all latent factors differed between genders. However, further analyses of logistic mixed models with all latent factors and prior mathematics achievement as predictors revealed that reported in-class anxiety was the primary discriminating factor between male and female students. © 2024 The Author(s). Published with license by Taylor & Francis Group, LLC.","Factor analysis; mathematics anxiety; mathematics self-concept; mathematics self-efficacy; multicollinearity","","Article","Final","All Open Access; Green Open Access; Hybrid Gold Open Access","Scopus","2-s2.0-85190431776"
"Guzmán B.; Rodríguez C.; Ferreira R.A.","Guzmán, Bárbara (57205202110); Rodríguez, Cristina (55574197791); Ferreira, Roberto A. (35749717800)","57205202110; 55574197791; 35749717800","Effect of parents’ mathematics anxiety and home numeracy activities on young children's math performance-anxiety relationship","2023","Contemporary Educational Psychology","72","","102140","","","16","10.1016/j.cedpsych.2022.102140","https://www.scopus.com/pages/publications/85143788289?origin=resultslist","A negative correlation between mathematics performance and mathematics anxiety (MA) has been identified in students of varying ages. However, little is known as to whether this correlation diminishes when environmental factors are incorporated as moderator variables. Specifically, the effect of home numeracy activities (HNA) and parental MA on students’ performance-MA relationship has received little attention. Furthermore, there have been no studies that consider HNA frequency as reported by the children themselves. A sample of 311 Chilean second graders and their parents participated in the present study. We examined whether HNA frequency moderates the performance-MA relationship and whether this moderation is in turn moderated by parent MA. Results showed that the frequency of HNA strengthened or diminished the negative correlation between performance and MA as a function of parent MA. In the case of parents with low MA, regardless of HNA frequency, child mathematics performance was negatively associated with child MA. However, in the case of math-anxious parents that interacted frequently with their children, there was no association between child MA and math achievement. More broadly, the present study suggests that mathematics-related family dynamics and parents’ emotions are key to understanding the relationship between performance and MA in early development. © 2022 Elsevier Inc.","Home numeracy activities; Math performance; Mathematics anxiety; Parents","","Article","Final","","Scopus","2-s2.0-85143788289"
